{
  "case_id": "FIRE-D2-COMP-001",
  "standard": "SP554_2026",
  "action": "sp554_fire_mechanical_guided",
  "member_route": "central_compression",
  "steel_strength_group": "ordinary",
  "high_strength_gost9651_qualified": false,
  "fire_resistant_gost9651_qualified": false,
  "fy_norm_n_mm2": 240.0,
  "E_norm_n_mm2": 206000.0,
  "route": {
    "N_n": 1000000.0,
    "A_gross_mm2": 10000.0,
    "gamma_c": 1.0,
    "lambda_bar": 1.5,
    "buckling_curve_type": "b",
    "phi_sp16_formula8": 0.8,
    "mu_length_sp16": 1.0,
    "member_length_mm": 3000.0,
    "J_min_mm4": 6324000.0
  }
}
